{
  "$schema": "https://json-schema.org/draft/2020-12/schema",
  "$id": "biv-json-envelope.v1",
  "type": "object",
  "description": "ok is true exactly when exit_code is 0 or 2 and error is null. Failure facts are carried under error.facts when known.",
  "required": ["envelope_version", "app_version", "ok", "verb", "exit_code", "warnings", "advisories", "result", "error"],
  "properties": {
    "envelope_version": {"const": 1},
    "app_version": {"type": "string"},
    "ok": {"type": "boolean"},
    "verb": {"enum": ["pack", "open", "list", "info"]},
    "exit_code": {"type": "integer"},
    "warnings": {
      "type": "array",
      "items": {
        "type": "object",
        "required": ["kind"],
        "properties": {
          "kind": {"type": "string"},
          "path": {"type": "string"},
          "artifact": {"type": "string"},
          "bytes": {"type": "integer", "minimum": 0, "description": "Artifact size in bytes."},
          "detail": {"type": "string"}
        }
      }
    },
    "advisories": {
      "type": "array",
      "items": {
        "oneOf": [
          {
            "type": "object",
            "required": ["kind", "entries"],
            "properties": {
              "kind": {"const": "prune-summary"},
              "entries": {
                "type": "array",
                "items": {
                  "type": "object",
                  "required": ["path", "source"],
                  "properties": {
                    "path": {"type": "string"},
                    "source": {
                      "type": "string",
                      "description": "Exactly builtin-v1 or .bivignore:<N>, where N is a 1-based root .bivignore line number."
                    }
                  }
                }
              }
            }
          },
          {
            "type": "object",
            "required": ["kind", "paths"],
            "properties": {
              "kind": {"const": "nested-bivignore-ignored"},
              "paths": {"type": "array", "items": {"type": "string"}}
            }
          },
          {
            "type": "object",
            "required": ["kind", "entries"],
            "properties": {
              "kind": {"const": "url-divergence-accepted"},
              "entries": {
                "type": "array",
                "minItems": 1,
                "items": {
                  "type": "object",
                  "required": ["requested", "effective", "op", "repo"],
                  "properties": {
                    "requested": {"type": "string"},
                    "effective": {"type": "string"},
                    "op": {"type": "string"},
                    "repo": {"type": "string"}
                  }
                }
              }
            }
          }
        ]
      }
    },
    "result": {
      "anyOf": [
        {"type": "null"},
        {
          "type": "object",
          "properties": {
            "image_path": {"type": "string"},
            "source_path": {"type": "string"},
            "source_path_flavor": {"enum": ["posix", "windows", "wsl"]},
            "image_id": {"type": "string"},
            "member_count": {"type": "integer"},
            "payload_bytes": {"type": "integer"},
            "output_dir": {"type": "string"},
            "collision_action": {"enum": ["none", "renamed", "refused"]},
            "restored_member_count": {"type": "integer"},
            "checksums_verified": {"type": "boolean"},
            "url_divergence_refusals": {
              "type": "array",
              "minItems": 1,
              "items": {
                "type": "object",
                "required": ["kind", "repo_id", "relpath", "requested", "effective", "op"],
                "properties": {
                  "kind": {"const": "UrlDivergenceEntryRefused"},
                  "repo_id": {"type": "string"},
                  "relpath": {"type": "string"},
                  "requested": {"type": "string"},
                  "effective": {"type": "string"},
                  "op": {"type": "string"}
                }
              }
            },
            "repos": {
              "type": "array",
              "minItems": 1,
              "items": {
                "type": "object",
                "additionalProperties": false,
                "required": ["id", "relpath", "outcome", "sha", "capture_mode", "local_refs", "advisories"],
                "properties": {
                  "id": {"type": "string"},
                  "relpath": {"type": "string"},
                  "outcome": {"enum": ["restored", "shallow-pointer", "payload-only-unborn", "failed", "offline-pointer"]},
                  "sha": {"type": ["string", "null"]},
                  "capture_mode": {"enum": ["overlay", "full", null]},
                  "local_refs": {
                    "type": "array",
                    "items": {
                      "type": "object",
                      "required": ["ref", "recreated", "skipped_at_sha"],
                      "properties": {
                        "ref": {"type": "string"},
                        "recreated": {"type": "boolean"},
                        "skipped_at_sha": {"type": "boolean"},
                        "detail": {"type": "string"}
                      }
                    }
                  },
                  "advisories": {"type": "array", "items": {"type": "string"}},
                  "shallow": {
                    "type": "object",
                    "required": ["boundary"],
                    "properties": {"boundary": {"type": "array", "items": {"type": "string"}}}
                  },
                  "branch": {"type": "string"},
                  "remotes": {"type": "array", "items": {"type": "string"}},
                  "bundle_path": {"type": "string"},
                  "reconstruct": {"type": "string"}
                },
                "allOf": [
                  {
                    "if": {"properties": {"outcome": {"enum": ["shallow-pointer", "payload-only-unborn"]}}},
                    "then": {"properties": {"capture_mode": {"const": null}}},
                    "else": {"properties": {"capture_mode": {"enum": ["overlay", "full"]}}}
                  },
                  {
                    "if": {"properties": {"outcome": {"const": "offline-pointer"}}},
                    "then": {"required": ["branch", "remotes"]},
                    "else": {
                      "not": {"anyOf": [
                        {"required": ["branch"]}, {"required": ["remotes"]},
                        {"required": ["bundle_path"]}, {"required": ["reconstruct"]}
                      ]}
                    }
                  },
                  {
                    "if": {"required": ["reconstruct"]},
                    "then": {"required": ["bundle_path"]}
                  },
                  {
                    "if": {"properties": {"outcome": {"const": "shallow-pointer"}}},
                    "then": {"required": ["shallow"]},
                    "else": {"not": {"required": ["shallow"]}}
                  }
                ]
              }
            },
            "sessions": {
              "type": "object",
              "required": ["prompt_shown", "warning_shown", "consent", "agents"],
              "properties": {
                "prompt_shown": {"type": "boolean"},
                "warning_shown": {"type": "boolean"},
                "consent": {
                  "type": "object",
                  "required": ["source", "values"],
                  "properties": {
                    "source": {"enum": ["flag", "prompt", "deny-default"]},
                    "values": {
                      "type": "array",
                      "items": {
                        "type": "object",
                        "required": ["agent", "value"],
                        "properties": {
                          "agent": {"type": "string"},
                          "value": {"enum": ["yes", "no"]}
                        }
                      }
                    }
                  }
                },
                "agents": {
                  "type": "array",
                  "items": {
                    "type": "object",
                    "required": ["agent", "capabilities_verdict", "store_root", "sessions", "activation", "caveats"],
                    "properties": {
                      "agent": {"type": "string"},
                      "capabilities_verdict": {"enum": ["readable-newer-than-survey", "readable", "unreadable", "absent"]},
                      "probe": {
                        "type": "object",
                        "required": ["agent", "requested", "executed", "pinned", "outcome", "exit_code", "raw", "parsed"],
                        "properties": {
                          "agent": {"type": "string"},
                          "requested": {"type": ["string", "null"]},
                          "executed": {"type": ["string", "null"]},
                          "pinned": {"type": "boolean"},
                          "outcome": {"enum": ["ok", "not_found", "not_executable", "not_accessible", "spawn_error", "nonzero_exit", "timeout", "unparseable", "probe_io_error"]},
                          "exit_code": {"type": "integer"},
                          "raw": {"type": "string"},
                          "parsed": {"type": ["string", "null"]}
                        }
                      },
                      "store_root": {"type": "string"},
                      "sessions": {
                        "type": "array",
                        "items": {
                          "type": "object",
                          "required": ["image_session_id", "outcome", "host_version_unverified", "activation_suppressed"],
                          "properties": {
                            "image_session_id": {"type": "string"},
                            "installed_session_id": {"type": "string"},
                            "outcome": {"enum": ["installed", "staged", "skipped", "failed"]},
                            "kind": {"enum": ["ContainmentRefused", "SessionInstallFailed", "UnknownAgentSkipped", "EntrySchemaSkipped", "SessionsConsentSkipped", "SessionsStaged", "AgentNotValidatedFailed"]},
                            "reason": {"type": "string"},
                            "host_version_unverified": {"type": "boolean"},
                            "activation_suppressed": {"type": "boolean"}
                          },
                          "allOf": [
                            {
                              "if": {"properties": {"outcome": {"enum": ["skipped", "failed"]}}},
                              "then": {"required": ["kind"]}
                            }
                          ]
                        }
                      },
                      "activation": {"type": "array", "items": {"type": "string"}},
                      "caveats": {"type": "array", "items": {"type": "string"}}
                    }
                  }
                }
              }
            },
            "manifest": {
              "type": "object",
              "required": ["format_version", "repos", "agent_sessions"],
              "properties": {
                "format_version": {"type": "integer"},
                "repos": {"type": "array"},
                "agent_sessions": {
                  "type": "array",
                  "items": {
                    "type": "object",
                    "required": ["agent", "session_count"],
                    "properties": {
                      "agent": {"type": "string"},
                      "session_count": {"type": "integer"}
                    }
                  }
                }
              }
            }
          }
        }
      ]
    },
    "error": {
      "anyOf": [
        {"type": "null"},
        {
          "type": "object",
          "required": ["kind", "path", "detail", "errno", "facts"],
          "properties": {
            "kind": {"type": "string"},
            "path": {"type": "string"},
            "detail": {"type": "string"},
            "errno": {"type": "integer"},
            "facts": {
              "type": "object",
              "properties": {
                "partial_path": {"type": "string"},
                "spool_path": {"type": "string"},
                "partial_dir": {"type": "string"},
                "requested": {"type": "string"},
                "effective": {"type": "string"},
                "op": {"type": "string"}
              }
            }
          }
        }
      ]
    }
  }
}
